{"event_id":"evt_02","event_type":"recording.available","event_version":1,"occurred_at":"2026-09-18T10:08:00Z","tenant_id":"tnt_demo","interaction_id":"int_01","aggregate_id":"rec_01","aggregate_version":4,"correlation_id":"int_01","causation_id":"evt_recording_stopped","producer":"recording-service","data_classification":"HIGHLY_SENSITIVE","data":{"recording_id":"rec_01","interaction_id":"int_01","available_at":"2026-09-18T10:08:00Z","duration_ms":420000,"policy_id":"rec_policy_1","retention_policy_id":"ret_365d","segments":[{"recording_segment_id":"rseg_01","start_offset_ms":0,"duration_ms":420000}]}}