{"event_id":"evt_01","event_type":"routing.agent.reserved","event_version":1,"occurred_at":"2026-09-18T10:00:00Z","tenant_id":"tnt_demo","interaction_id":"int_01","aggregate_id":"route_01","aggregate_version":2,"correlation_id":"int_01","causation_id":"evt_route_started","producer":"routing-service","data_classification":"INTERNAL","data":{"routing_attempt_id":"route_01","reservation_id":"res_01","interaction_id":"int_01","agent_id":"agt_1001","queue_id":"q_support","reserved_at":"2026-09-18T10:00:00Z","lease_expires_at":"2026-09-18T10:00:20Z","routing_policy_version":"rp_7"}}